Año , Mes , Estamento , Nombre completo , Cargo o función , Grado EUS / Cargo con jornada , Calificación profesional o formación , Región , Asignaciones especiales , Unidad monetaria , Remuneración bruta mensualizada , Remuneración líquida mensualizada , Montos y horas extraordinarias diurnas , Montos y horas extraordinarias nocturnas , Montos y horas extraordinarias festivas , Fecha de inicio dd/mm/aa , Fecha de término dd/mm/aa , Declaración de intereses y patrimonio (publicación por buena práctica) , Viáticos , Observaciones
2020,Mayo,Profesional,Alvarez Ortega, Yashna Violeta,JEFE DEPTO. SOCIAL,11,Asistente Social,Región de Los Lagos,(07)(06)(05)(03)(02)(01),Pesos,2.477.965,2.094.794,No tiene,No tiene,No tiene,01/02/2007,Indefinido,Sin observaciones,No publica,No informa,2020,
Mayo,Auxiliar,Barrera Navarro, Hugo Fernando,CHOFER,15,6° año básico,Región de Los Lagos,(07)(05)(03)(02)(01),Pesos,1.588.725,1.365.955,No tiene,No tiene,No tiene,01/03/1988,Indefinido,Sin observaciones,No publica,No informa,2020,
Mayo,Técnico,Carvallo Pardo, Gladys Elizabeth,TESORERA MUNICIPAL,12,Enseñanza Media,Región de Los Lagos,(08)(07)(05)(03)(02)(01),Pesos,2.343.456,2.004.840,$93.995 : 23,00hrs,No tiene,No tiene,01/09/1987,Indefinido,Sin observaciones,No publica,No informa,2020,
Mayo,Auxiliar,Castillo Castillo, Fernando Andrés,BODEGUERO,16,Enseñanza media,Región de Los Lagos,(07)(05)(03)(02)(01),Pesos,1.160.741,1.014.106,No tiene,No tiene,No tiene,01/03/1988,Indefinido,Sin observaciones,No publica,No informa,2020,
Mayo,Directivo,Dominguez Pareglio, Paulo César,DIRECTOR DE CONTROL,8,Contador Auditor,Región de Los Lagos,(07)(05)(03)(02),Pesos,4.028.515,3.359.544,$165.778 : 19,00hrs,No tiene,$11.743 : 1,00hrs,22/05/2017,Indefinido,Sin observaciones,No publica,No informa,2020,
Mayo,Directivo,Flores Torres, Joselin,DIECTORA OBRAS MUNICIPALES,10,Ingeniera Constructora,Región de Los Lagos,(07)(06)(05)(03)(02)(01),Pesos,2.917.199,2.384.121,No tiene,No tiene,No tiene,01/01/2011,Indefinido,Sin observaciones,No publica,No informa,2020,
Mayo,Directivo,Gelvez Gelvez, Guizela,DIDECO,8,Asistente Social,Región de Los Lagos,(07)(05)(03)(02),Pesos,3.881.939,3.304.917,No tiene,No tiene,No tiene,01/09/2014,Indefinido,Sin observaciones,No publica,No informa,2020,
Mayo,Auxiliar,González González, Ernesto Enrique,CHOFER,17,3° Enseñanza Media,Región de Los Lagos,(07)(05)(03)(02)(01),Pesos,1.351.498,1.166.825,No tiene,No tiene,No tiene,01/01/1995,Indefinido,Sin observaciones,No publica,No informa,2020,
Mayo,Alcalde,Grandón Domke, Fernando Erwin,ALCALDE,6,Ingeniero Forestal,Región de Los Lagos,(05)(04)(01),Pesos,6.343.676,5.238.181,No tiene,No tiene,No tiene,07/12/2016,06/12/2020,Sin observaciones,No publica,118.516,2020,
Mayo,Directivo,Hernández Hellriegel, Mabel Elianet,DIRECTORA ADMINISTRACIÓN Y FINANZAS,8,Contador Auditor,Región de Los Lagos,(07)(06)(05)(03)(02)(01),Pesos,4.217.607,3.593.606,$220.981 : 26,00hrs,No tiene,$60.222 : 6,00hrs,01/07/2001,Indefinido,Sin observaciones,No publica,No informa,2020,
Mayo,Auxiliar,Lara Roldán, Francisco Manuel,INSPECTOR MUNICIPAL,20,Técnico en Construcción,Región de Los Lagos,(07)(05)(03)(02)(01),Pesos,1.115.829,970.877,$5.998 : 3,00hrs,No tiene,$15.784 : 7,00hrs,15/01/2019,Indefinido,Sin observaciones,No publica,No informa,2020,
Mayo,Administrativo,Mancilla Almonacid, José Antonio,ENCARGADO PERSONAL CALLES,15,3° Enseñanza Media,Región de Los Lagos,(07)(05)(03)(02)(01),Pesos,1.651.661,1.299.257,No tiene,No tiene,No tiene,15/12/1978,Indefinido,Sin observaciones,No publica,No informa,2020,
Mayo,Directivo,Mardones Segovia, Miguel Angel,SECRETARIO MUNICIPAL,8,Administrador Público,Región de Los Lagos,(07)(05)(03)(02),Pesos,3.881.939,3.304.917,No tiene,No tiene,No tiene,09/06/2015,Indefinido,Sin observaciones,No publica,No informa,2020,
Mayo,Auxiliar,Peña Gélvez, Angelo Patricio,CHOFER,20,Enseñanza Media,Región de Los Lagos,(07)(05)(03)(02)(01),Pesos,1.234.399,1.075.516,No tiene,No tiene,No tiene,01/12/2016,Indefinido,Sin observaciones,No publica,No informa,2020,
Mayo,Técnico,Peña Munzenmayer, Eduardo Enrique,ENCARGADO DE SECCIÓN MEDIO AMBIENTE, ENERGÍA Y RESIDUOS,13,Biólogo Marino,Región de Los Lagos,(08)(07)(05)(03)(02)(01),Pesos,1.517.699,1.318.576,No tiene,No tiene,No tiene,15/03/2020,Indefinido,Sin observaciones,No publica,No informa,2020,
Mayo,Directivo,Silva Reichart, Anton Nicolas,DIRECTOR DE SEGURIDAD PÚBLICA DE LA COMUNA DE FUTALEUFÚ,10,Abogado,Región de Los Lagos,(07)(06)(05)(03)(02)(01),Pesos,3.020.738,2.548.518,$68.710 : 12,00hrs,No tiene,$13.742 : 2,00hrs,15/05/2018,Indefinido,Sin observaciones,No publica,23.703,2020,
Mayo,Directivo,Steel Bouza, Paul Sebastián,SECPLAN,8,Arquitecto,Región de Los Lagos,(06)(05)(03)(02)(01),Pesos,3.245.913,2.739.414,No tiene,No tiene,No tiene,01/03/2020,Indefinido,Sin observaciones,No publica,No informa,2020,
Mayo,Administrativo,Villagrán Bañarez, Jorge Iván,AYUDANTE D.O.M.,14,Enseñanza Media,Región de Los Lagos,(07)(05)(03)(02)(01),Pesos,1.762.261,1.510.141,No tiene,No tiene,No tiene,01/08/1991,Indefinido,Sin observaciones,No publica,No informa,