Año , Mes , Estamento , Nombre completo , Cargo o función , Grado EUS / Cargo con jornada , Calificación profesional o formación , Región , Asignaciones especiales , Unidad monetaria , Remuneración bruta mensualizada , Remuneración líquida mensualizada , Montos y horas extraordinarias diurnas , Montos y horas extraordinarias nocturnas , Montos y horas extraordinarias festivas , Fecha de inicio dd/mm/aa , Fecha de término dd/mm/aa , Declaración de intereses y patrimonio (publicación por buena práctica) , Viáticos , Observaciones
2020,Febrero,Técnico,ALVARADO MANSILLA, IRENE SOLEDAD,TECNICA,11,TECN.ADMINISTRATIVO,Región de Los Lagos,(01),Pesos,1.184.347,No tiene,No tiene,No tiene,15/02/1995,Indefinido,Sin observaciones,No publica,No informa,2020,Febrero,
Administrativo,ALVARADO TALMAR, JUAN CARLOS,ADMINISTRATIVA,14,CHOFER,Región de Los Lagos,(01),Pesos,1.147.304,$49.793 : 17,00hrs,$246.037 : 70,00hrs,No tiene,15/11/1996,Indefinido,Sin observaciones,No publica,No informa,2020,Febrero,Alcalde,
ANGULO MUÑOZ, VICTOR RUBEN,ALCALDE,5,CONTADOR GENERAL,Región de Los Lagos,(01),Pesos,5.025.812,No tiene,No tiene,No tiene,08/10/2015,Indefinido,Sin observaciones,No publica,No informa,2020,Febrero,Directivo,ANTIMAN HUERQUE, MARCIA ELIZABETH,
DIRECTIVO,7,ADMINISTRADOR PUBLICO,Región de Los Lagos,(01),Pesos,2.511.263,No tiene,No tiene,No tiene,19/10/2015,Indefinido,Sin observaciones,No publica,No informa,2020,Febrero,Técnico,BARRIA SILVA, PATRICIA DEL CARMEN,TECNICA,
12,TECNICO CON MENCION EN BIENESTAR SOCIAL,Región de Los Lagos,(01),Pesos,1.258.054,$99.994 : 25,00hrs,$43.198 : 9,00hrs,No tiene,01/04/2008,Indefinido,Sin observaciones,No publica,No informa,2020,Febrero,Auxiliar,CABRERA VERA, LUIS ORLANDO,AUXILIAR,14,
AUXILIAR MUNICIPAL,Región de Los Lagos,(01),Pesos,863.188,$61.509 : 21,00hrs,$66.782 : 19,00hrs,No tiene,03/06/2019,Indefinido,Sin observaciones,No publica,No informa,2020,Febrero,Auxiliar,CARDENAS VERA, RAUL ALFREDO,AUXILIAR,18,CHOFER,
Región de Los Lagos,(01),Pesos,757.693,$56.433 : 28,00hrs,$164.461 : 68,00hrs,No tiene,01/07/2016,Indefinido,Sin observaciones,No publica,No informa,2020,Febrero,Profesional,CARRIL AGUERO, JUAN GABRIEL,PROFESIONAL,11,INGENIERO EN GESTION DE RECURSOS HUMANOS,Región de Los Lagos,
(01),Pesos,1.401.206,$81.344 : 17,00hrs,No tiene,No tiene,01/01/2015,Indefinido,Sin observaciones,No publica,No informa,2020,Febrero,Directivo,CARTES SEPULVEDA, GLORIA,DIRECTIVO,7,ADMINISTRADOR PUBLICO,Región de Los Lagos,(01),
Pesos,2.511.263,No tiene,No tiene,No tiene,06/11/2015,Indefinido,Sin observaciones,No publica,No informa,2020,Febrero,Técnico,CISTERNA MANSILLA, PAULA JULIETA,TECNICA,13,SECRETARIA,Región de Los Lagos,(01),Pesos,
968.023,No tiene,No tiene,No tiene,06/06/2008,Indefinido,Sin observaciones,No publica,No informa,2020,Febrero,Administrativo,DELGADO VALDEBENITO, JAVIER ANDRES,ADMINISTRATIVA,13,ENCARGADO INFORMATICA,Región de Los Lagos,(01),Pesos,1.014.565,
$44.144 : 13,00hrs,No tiene,No tiene,03/04/2008,Indefinido,Sin observaciones,No publica,No informa,2020,Febrero,Técnico,FLEIDL CARRASCO, JOHANNS STEVE,TECNICA,12,TECNICO EN COMPUTACION,Región de Los Lagos,(01),Pesos,1.149.897,No tiene,
$191.989 : 40,00hrs,No tiene,03/06/2019,Indefinido,Sin observaciones,No publica,No informa,2020,Febrero,Directivo,FLORES MERINO, PABLO ANDRES,DIRECTIVO,7,ABOGADO,Región de Los Lagos,(01),Pesos,2.511.263,No tiene,No tiene,
No tiene,01/12/2015,Indefinido,Sin observaciones,No publica,No informa,2020,Febrero,Auxiliar,FRANCO AGUILA, MIGUEL ANGEL,AUXILIAR,17,TECNICO EN PREVENCION DE RIESGO,Región de Los Lagos,(01),Pesos,584.601,No tiene,No tiene,No tiene,
01/01/2015,Indefinido,Sin observaciones,No publica,No informa,2020,Febrero,Técnico,GALINDO CARCAMO, ANITA MARISOL,TECNICA,10,TECNICO,Región de Los Lagos,(01),Pesos,1.443.620,No tiene,No tiene,No tiene,15/02/1995,
Indefinido,Sin observaciones,No publica,No informa,2020,Febrero,Directivo,GODOY DIAZ, RENE OMAR,DIRECTIVO,8,ABOGADO,Región de Los Lagos,(01),Pesos,2.101.637,No tiene,No tiene,No tiene,01/01/2017,Indefinido,
Sin observaciones,No publica,No informa,2020,Febrero,Administrativo,GONZALEZ JARA, HERNAN RODRIGO,ADMINISTRATIVA,13,EMPLEADO,Región de Los Lagos,(01),Pesos,1.042.214,No tiene,No tiene,No tiene,01/08/2002,Indefinido,Sin observaciones,
No publica,No informa,2020,Febrero,Administrativo,HENRIQUEZ BARRIOS, HECTOR MARIO,ADMINISTRATIVA,13,SECREATARIO JUZGADO POLICIA LOCAL,Región de Los Lagos,(01),Pesos,922.674,No tiene,No tiene,No tiene,10/09/1990,Indefinido,Sin observaciones,No publica,
No informa,2020,Febrero,Directivo,INZUNZA BETANZO, MARIA ANGELICA,DIRECTIVO,8,ASISTENTE SOCIAL,Región de Los Lagos,(01),Pesos,2.500.888,No tiene,No tiene,No tiene,19/06/1991,Indefinido,Sin observaciones,No publica,No informa,
2020,Febrero,Directivo,KUSCH LOEBEL, SERGIO ADRIAN,DIRECTIVO,7,ABOGADO,Región de Los Lagos,(01),Pesos,3.370.114,No tiene,No tiene,No tiene,01/01/1981,Indefinido,Sin observaciones,No publica,No informa,2020,
Febrero,Jefatura,MANCILLA HARO, DORALIZA YANETT,JEFATURA,11,INGENIERO ADM.EMPRESAS,Región de Los Lagos,(01),Pesos,1.301.924,$4.785 : 1,00hrs,No tiene,No tiene,03/06/2019,Indefinido,Sin observaciones,No publica,No informa,2020,Febrero,
Jefatura,MANCILLA VIVAR, CARMEN ROSA,JEFATURA,10,OFICINISTA MECANOGRAFA,Región de Los Lagos,(01),Pesos,1.677.916,$86.538 : 15,00hrs,No tiene,No tiene,01/02/1982,Indefinido,Sin observaciones,No publica,No informa,2020,Febrero,Auxiliar,
MANSILLA PEREZ, CRISTIAN VICTOR,AUXILIAR,14,CHOFER,Región de Los Lagos,(01),Pesos,1.106.707,$29.290 : 10,00hrs,$246.037 : 70,00hrs,No tiene,01/01/2015,Indefinido,Sin observaciones,No publica,No informa,2020,Febrero,Directivo,MIRANDA VIVAR, JAIRO ANTONIO,
DIRECTIVO,7,INGENIERO INFORMAT,Región de Los Lagos,(01),Pesos,2.500.958,No tiene,No tiene,No tiene,01/12/2016,Indefinido,Sin observaciones,No publica,No informa,2020,Febrero,Administrativo,OJEDA VILLARROEL, JORGE HERNAN,ADMINISTRATIVA,
14,AUXILIAR BODEGA,Región de Los Lagos,(01),Pesos,824.166,No tiene,No tiene,No tiene,01/04/2008,Indefinido,Sin observaciones,No publica,No informa,2020,Febrero,Auxiliar,PAREDES GALLARDO, SEGUNDO JUAN,AUXILIAR,14,
AUXILIAR BODEGA,Región de Los Lagos,(01),Pesos,816.312,No tiene,No tiene,No tiene,01/08/2002,Indefinido,Sin observaciones,No publica,No informa,2020,Febrero,Directivo,PAREDES VILLEGAS, RAIMUNDO JAVIER,DIRECTIVO,8,ARQUITECTO,
Región de Los Lagos,(01),Pesos,2.408.148,No tiene,No tiene,No tiene,09/06/2006,Indefinido,Sin observaciones,No publica,No informa,2020,Febrero,Administrativo,PINCHEIRA LINEROS, JOSE MARCELO,ADMINISTRATIVA,14,EXAMINADOR PRACTICO,Región de Los Lagos,
(01),Pesos,843.921,$2.929 : 1,00hrs,No tiene,No tiene,01/06/2002,Indefinido,Sin observaciones,No publica,No informa,2020,Febrero,Profesional,RAMIREZ FUENZALIDA, GONZALO EDUARDO,PROF./L.15076,No Asimilado a Grado,MEDICO,Región de Los Lagos,(01),
Pesos,896.248,No tiene,No tiene,No tiene,05/03/1984,Indefinido,Sin observaciones,No publica,No informa,2020,Febrero,Administrativo,REYES LEIVA, MARIA ANGELICA,ADMINISTRATIVA,14,ADMINISTRATIVA,Región de Los Lagos,(01),Pesos,
918.804,$52.722 : 18,00hrs,No tiene,No tiene,01/01/2015,Indefinido,Sin observaciones,No publica,No informa,2020,Febrero,Administrativo,REYES ROMERO, VICTOR EUGENIO,ADMINISTRATIVA,14,ENCARGADO DE BODEGA,Región de Los Lagos,(01),Pesos,972.442,
No tiene,$98.415 : 28,00hrs,No tiene,01/04/2000,Indefinido,Sin observaciones,No publica,No informa,2020,Febrero,Auxiliar,ROGEL LEVICAN, YOCELYN VIVIANA,AUXILIAR,17,TECNICO EN COMERCIO EXTERIOR,Región de Los Lagos,(01),Pesos,570.286,No tiene,
No tiene,No tiene,01/06/2016,Indefinido,Sin observaciones,No publica,No informa,2020,Febrero,Administrativo,SAEZ CARRILLO, NATALIA ANDREA,ADMINISTRATIVA,16,ASISTENTE SOCIAL,Región de Los Lagos,(01),Pesos,638.789,$7.337 : 3,00hrs,No tiene,
No tiene,03/06/2019,Indefinido,Sin observaciones,No publica,No informa,2020,Febrero,Auxiliar,SANCHEZ GONZALEZ, FRANCISCO ROLANDO,AUXILIAR,16,CHOFER,Región de Los Lagos,(01),Pesos,988.679,$56.253 : 23,00hrs,$205.446 : 70,00hrs,No tiene,
01/01/2015,Indefinido,Sin observaciones,No publica,No informa,2020,Febrero,Directivo,VERA URIBE, MARINA LOURDES,DIRECTIVO,7,ASISTENTE SOCIAL,Región de Los Lagos,(01),Pesos,2.966.585,No tiene,No tiene,No tiene,01/01/1994,
Indefinido,Sin observaciones,No publica,No informa,